{
  "sequence_id": "example_full_fight_8_shots",
  "project_id": "example_project",
  "episode_id": "ep01",
  "style_route": "3d_guoman_cinematic",
  "shared_asset_bindings": [
    {
      "role": "character_ref",
      "name": "hero fictional cultivator reference",
      "source_id": "asset_char_hero",
      "order": 1,
      "rights_status": "original_or_authorized"
    },
    {
      "role": "character_ref",
      "name": "enemy spear guardian reference",
      "source_id": "asset_char_enemy",
      "order": 2,
      "rights_status": "original_or_authorized"
    },
    {
      "role": "scene_ref",
      "name": "rain courtyard with stone stairs",
      "source_id": "asset_scene_courtyard",
      "order": 3,
      "rights_status": "generated_project_asset"
    },
    {
      "role": "weapon_ref",
      "name": "short sword and long spear reference",
      "source_id": "asset_weapon_pair",
      "order": 4,
      "rights_status": "original_or_authorized"
    },
    {
      "role": "first_frame",
      "name": "sequence opening layout frame",
      "source_id": "frame_seq_first",
      "order": 5,
      "rights_status": "generated_project_asset"
    },
    {
      "role": "vfx_style_ref",
      "name": "gold suppression floor seal style",
      "source_id": "asset_vfx_gold_seal",
      "order": 6,
      "rights_status": "generated_project_asset"
    }
  ],
  "shots": [
    {
      "project_id": "example_project",
      "episode_id": "ep01",
      "shot_id": "seq08_01_layout",
      "sequence_role": "establishing_combat_layout",
      "is_combat_shot": true,
      "style_route": "3d_guoman_cinematic",
      "fight_director": {
        "fight_intent": "establish the unequal battlefield and pressure direction",
        "combatants": [
          "hero lower right wounded but standing",
          "enemy higher left with long spear"
        ],
        "tactical_objective": "show that the hero must cross distance under spear pressure",
        "opponent_counter_pressure": "enemy owns the higher stairs and keeps spear reach pointed downward",
        "spatial_map": "rain courtyard, hero screen right lower level, enemy screen left upper stairs, pillars and wet floor as anchors",
        "action_chain": [
          "wide layout reveals distance",
          "enemy spear points down",
          "hero shifts weight forward"
        ],
        "result_state": "viewer understands left-right axis and vertical disadvantage before the charge",
        "risk_level": "level_1_contact setup",
        "readability_plan": "silent viewer can read who is higher, who is pressured, and where movement must go"
      },
      "combat_beat": {
        "beat_type": "pressure_lock",
        "screen_action": "enemy holds upper-left space while hero prepares at lower-right edge",
        "tactical_meaning": "the shot defines the problem before action begins",
        "anticipation": "rain falls through the empty distance between them",
        "contact_or_collision": "no contact yet; spear line threatens the center lane",
        "impact_feedback": "pressure is shown by spear shadow and hero's compressed stance",
        "reaction": "hero narrows stance and watches the spear tip",
        "aftermath": "the distance line is set for the next approach",
        "camera_logic": "wide low layout, locked axis",
        "vfx_logic": "none except wet reflections",
        "continuity_out": "hero remains lower right, enemy remains upper left"
      },
      "impact_system": {
        "impact_level": "level_1_contact",
        "pre_impact": "empty rain distance and spear shadow create threat",
        "contact_frame": "no physical contact in this layout shot",
        "hitstop": "brief held wide frame",
        "recoil": "none yet, only clothing moved by rain wind",
        "environment_feedback": "wet floor reflects both fighters",
        "sound_hint": "distant rain and low tension only",
        "aftermath_pose": "hero low right ready to move, enemy high left controlling lane"
      },
      "vfx_power": {
        "vfx_type": "none",
        "source": "none",
        "shape_language": "wet reflection only",
        "motion_behavior": "rain fall",
        "color_temperature": "cold blue night",
        "interaction_with_body": "cloth lightly moves",
        "interaction_with_environment": "rain and reflections define depth",
        "visibility_rule": "VFX must support action readability, not hide contact frame",
        "start_state": "clear space",
        "peak_state": "clear space",
        "end_state": "clear space"
      },
      "camera_coverage": {
        "shot_type": "establishing_combat_layout",
        "camera_distance": "wide low angle",
        "lens_feel": "wide depth with stairs and wet floor",
        "camera_motion": "locked slow push",
        "screen_direction": "future hero movement goes right to left and upward",
        "subject_priority": "battlefield relation first, spear threat second, hero readiness third",
        "cut_point": "cut when hero leans forward",
        "continuity_from_previous": "sequence begins here",
        "continuity_to_next": "next shot starts with hero charging from lower right toward upper left"
      },
      "provider_route_strategy": {
        "route": "video_final_route",
        "duration": "5 seconds",
        "complexity_level": "medium",
        "reference_requirements": [
          "character_ref",
          "scene_ref",
          "weapon_ref",
          "first_frame",
          "vfx_style_ref"
        ],
        "first_frame_plan": "wide layout frame with hero low right and enemy high left",
        "end_frame_plan": "hero leaning forward from lower right",
        "prompt_compression_rule": "show spatial relation and pressure, no combat contact yet",
        "provider": "user_confirmed_video_provider",
        "model": "user_confirmed_video_model",
        "route_class": "high_control_final",
        "unsupported_controls": [],
        "fallback_route": "package_only_dry_run"
      },
      "combat_tempo": {
        "duration_seconds": 5.0,
        "key_poses": [
          "enemy holds dominant high line",
          "hero stays low in opposite screen side",
          "rain and floor reflections reveal distance",
          "weapon line points across the gap",
          "hero shifts weight toward first move",
          "extra readable key pose for tempo density"
        ],
        "action_events": [
          "layout reveals both combatants and route",
          "enemy pressure line narrows the safe path",
          "hero prepares a low entry"
        ],
        "force_feedback": "rain, weapon angle, and body crouch show pressure before contact",
        "major_traversal_window": "extended duration is justified by environment reveal, power reveal, aftermath, or readable hold",
        "speed_curve": "held pressure, small weight shift, ready-to-burst ending; front-load at least 60% of events before 70% of duration, then hold reaction or landing",
        "density_check": "pass",
        "target_duration_policy": "extended_special_5s_plus",
        "event_distribution": {
          "frontloaded_event_ratio": 0.67,
          "frontload_window_ratio": 0.7,
          "ending_hold_ratio": 0.25,
          "ending_hold_purpose": "cut_ready_hold"
        }
      },
      "prompt_human_readable_zh": "é›¨å¤œçŸ³åº­å¤§è¿œæ™¯ï¼Œæ•Œäººåœ¨å·¦ä¾§é«˜å°ä»¥é•¿æžªåŽ‹ä½ç©ºé—´ï¼Œä¸»è§’åœ¨å³ä¾§ä½Žä½å‡†å¤‡å†²å…¥ã€‚",
      "prompt_canonical_en": "3D guoman cinematic rain courtyard layout, enemy high left with spear pressure, hero low right preparing to cross the wet stone distance.",
      "provider_execution_prompt": "Wide low-angle rain courtyard at night. Hero stands lower on screen right in a compressed stance, enemy spear guardian is higher on screen left at the stairs, spear tip aimed down across the center lane. Wet stone floor and broken pillars show distance and depth. Slow locked push only, no contact yet; end as the hero leans forward to charge. No gore, no teleporting, no subtitles, no UI.",
      "negative_constraints": [
        "no gore",
        "no teleporting",
        "no contact yet",
        "no subtitles"
      ],
      "asset_bindings": [
        {
          "role": "character_ref",
          "name": "hero reference",
          "source_id": "asset_char_hero",
          "order": 1,
          "rights_status": "original_or_authorized"
        },
        {
          "role": "scene_ref",
          "name": "rain courtyard",
          "source_id": "asset_scene_courtyard",
          "order": 2,
          "rights_status": "generated_project_asset"
        },
        {
          "role": "weapon_ref",
          "name": "spear and sword",
          "source_id": "asset_weapon_pair",
          "order": 3,
          "rights_status": "original_or_authorized"
        },
        {
          "role": "first_frame",
          "name": "wide layout frame",
          "source_id": "frame_seq_first",
          "order": 4,
          "rights_status": "generated_project_asset"
        },
        {
          "role": "vfx_style_ref",
          "name": "wet blue night style",
          "source_id": "asset_vfx_rain_style",
          "order": 5,
          "rights_status": "generated_project_asset"
        }
      ],
      "qc_expectations": [
        "axis is clear",
        "height disadvantage is visible",
        "spear threat is readable",
        "next charge direction is set"
      ],
      "combat_qc_score": {
        "action_readability": 5,
        "tactical_clarity": 5,
        "contact_believability": 5,
        "impact_feedback": 4,
        "spatial_continuity": 5,
        "vfx_readability": 5,
        "style_consistency": 5,
        "cutability": 5
      },
      "qc_evidence": {
        "action_readability": "The shot is a clean layout with no overloaded action.",
        "tactical_clarity": "The hero's problem is crossing upward under spear pressure.",